date,year,month,day,day_of_week,week_of_year,season,workout_type,minutes,minutes_raw,miles,pace_min_per_mile,comments,extras,is_race,race_name,race_distance,race_time,source_file
2004-11-03,2004,11,3,Wednesday,45,fall,fartlek,53.82,53:49,6.0,8.97,"~30 min of fartlek on the esplanade (12:01 to the head, 10:36 coming back), with the three-thirds format. instructions were to do shorter bursts (200-400m). Fell back on most of the ones that I didn't lead but I think it was a good workout, other than the dark.",spb (finally!),0,,,,fall04log.html
2004-11-04,2004,11,4,Thursday,45,fall,run,58.38,58:23,7.5,7.784,"A zippy science-river loop (Julia and Erica together are nuts) plus two laps around the turf to add strides. feels great to be running full workouts and not cross training. funny though, seems like the mileage assignments are higher than during the regular season",medball,0,,,,fall04log.html
2004-11-05,2004,11,5,Friday,45,fall,intervals,,,5.0,,"at fenway: 1x1600, 4x600. Goals: 6:15, 2:12. Recovery was walk the diagonals, which ended up being around 2:10-2:15. pretty windy today; HBH had us start in the back corner so we got to finish with the wind, but it was still pretty intense. 6:20, 2:14, 2:15, 2:15, 2:12. Feeling really good about my mental control over my body, I worked just a little past where I wanted to be working.","2 sets sp, 13:38 wu, 13:26 cd",0,,,,fall04log.html
2004-11-06,2004,11,6,Saturday,45,fall,run,44.95,44:57,5.5,8.1727,"easy run down the river, since i took monday off",,0,,,,fall04log.html
2004-11-07,2004,11,7,Sunday,45,fall,long run,73.45,73:27,9.25,7.9405,"wow, the run felt sluggish and my legs were tight, but when I looked up the bridge loop (Elliot-Longfellow) I found out that I actually ran futher (and faster) than I thought. Nice...","drills, 4x70 m strides",0,,,,fall04log.html
2004-11-08,2004,11,8,Monday,46,fall,fartlek,54.75,54:45,6.0,9.125,"same as last week, warm up to the Fielder head, 30' of fartlek. This week we were told to keep them between 200-300m. Was feeling awesome on this workout, not getting dropped, until the 3rd to last one, when my lower back/IT band tightened up. Stuck out that one but only did half of the next surge, then passed on the last. Fell back on the cool down. Don't think it was anything lasting, just not enough stretching on a cool day.",sp,0,,,,fall04log.html
2004-11-09,2004,11,9,Tuesday,46,fall,run,,(37),4.75,,,medball,0,,,,fall04log.html
2004-11-10,2004,11,10,Wednesday,46,fall,intervals,,,4.5,,"5x400, 1x1600 on the track, 100m walk recovery (~95 s). Goal times were 88 and 6:15, with instructions for the mile to be slow for the first 3 laps, and go on the last one. Workout was 88, 87, 87, 88, 87, 6:05, definitely going on the last lap. felt like i didn't work too hard.","12:44 wu, 11:18 cd",0,,,,fall04log.html
2004-11-12,2004,11,12,Friday,46,fall,pre-meet,15.78,15:47,2.0,7.89,,"drills, 5x70m strides",0,,,,fall04log.html
2004-11-13,2004,11,13,Saturday,46,fall,,,,6.5,,"Hey, well, it didn't suck. Satisfied with the finish. Still not hitting last year's times, but oh well. I put in a good effort. Last 1.5 mi a girl from Wellesley kept talking to me and encouraging me, which was absolutely awesome. Christine Grant... without her I might have packed it in toward the end. After I realized that she was saying good job to me, I tried to reciprocate the favor and we passed people together until the last 600 m where I had no more gas. Finished just over a second behind her. Good to have something pushing me in the race. And congratulations to Julia, 29th place for All-New England Region honors. Following last week's performance, I could not think of a better way to end a cross country career.","16:11 wu, 11:55 cd",1,"NCAA D3 NE Regionals, Cumberland, ME",6k,24:45,fall04log.html
2004-11-27,2004,11,27,Saturday,48,winter,run,,(35),,,"Went to Betsy's house in Poughkeepsie for Thanksgiving weekend. She took Jordan and me on a great run through the Vassar College farms. Nice wooded bike trail--we saw a couple of deer and wild turkeys, pretty crazy. Definitely feeling the effects of two weeks of not quite taking care of myself, but I'm not regretting it. Skipping indoor, so I'm going to begin my campaign for a crazy track season when I get home for winter break.",,0,,,,winter04log.html
2004-11-28,2004,11,28,Sunday,48,winter,run,,?,4.75,,longfellow-BU. oof.,"4 short strides, lunges, sp, lifting",0,,,,winter04log.html
2004-11-30,2004,11,30,Tuesday,49,winter,run,40.12,40:07,5.0,8.024,Happy Birthday Mom,"4 short strides, lunges, 2 sets sp, lifting",0,,,,winter04log.html
2004-12-02,2004,12,2,Thursday,49,winter,run,50.33,50:20,,,explored around Brookline; ended up running up Summit Ave,lunges,0,,,,winter04log.html
2004-12-03,2004,12,3,Friday,49,winter,run,54.02,54:01,,,"to Charlestown, down to the shipyard, wandernig","strides, sp, lifting",0,,,,winter04log.html
2004-12-04,2004,12,4,Saturday,49,winter,run,,?,,,ran longfellow-harvard with Mike and his friend from HS,,0,,,,winter04log.html
2004-12-05,2004,12,5,Sunday,49,winter,run,40.08,40:05,,,,lunges,0,,,,winter04log.html
2004-12-06,2004,12,6,Monday,50,winter,run,21.53,21:32,,,"went to practice today, just for company. did 30+ min of continuous warmup, then a mile tempo, then cooldown to longfellow and back. everything but the cooldown was inside, and when we got outside, it was snowing! yay! I don't know if I ran faster on the cooldown or if i'm just out of shape, but I felt like the I got a bit overexcited by the snow and had a little extra bounce in my step.",medball,0,,,,winter04log.html
2004-12-07,2004,12,7,Tuesday,50,winter,run,39.83,39:50,,,,lunges,0,,,,winter04log.html
2004-12-09,2004,12,9,Thursday,50,winter,run,33.15,33:09,4.5,7.3667,"to JFK bridge and back, starting from MacGregor... seems fast but I think it was, I was a little excited...","lunges, 4 short strides, some core strengthening",0,,,,winter04log.html
2004-12-10,2004,12,10,Friday,50,winter,lifting,,,,,"my toe is a little sore still, so I didn't really feel like running, and I figured there was no reason in forcing it. lifted at the z-center for about 50 min",sp,0,,,,winter04log.html
2004-12-11,2004,12,11,Saturday,50,winter,run,50.2,50:12,,,perfect running weather. went along the emerald necklace,"4 short strides, lunges",0,,,,winter04log.html
2004-12-12,2004,12,12,Sunday,50,winter,run,75.73,75:44,,,"Another day of perfect running weather. Can't believe I'm wearing shorts and a t-shirt in December, in Boston. This was the longest run I've done in a while. Went exploring again--out Beacon to the Chestnut Hill Reservior. Just over 9 miles including going around the reservior, according to Microsoft Streets. Nice run, although I could do without running on the sidewalk all the way there. Haha, on the way back though, I passed by this path marked ""Summit Path"" and thought, ""oh, hey there's a Summit Path at the top of Summit Ave, I wonder if this connects."" And of course it did, and of course the other end of the path is at the top of a fatty hill, and of course I climbed a lot of stairs to get there. Oh well","sp, included strides at the end",0,,,,winter04log.html
2004-12-13,2004,12,13,Monday,51,winter,lifting,,,,,I need new shoes. lifted for a bit to get some activity after my two finals,,0,,,,winter04log.html
2004-12-14,2004,12,14,Tuesday,51,winter,run,45.87,45:52,,,,"lunges, 4 short strides",0,,,,winter04log.html
2004-12-15,2004,12,15,Wednesday,51,winter,run,42.7,42:42,5.7,7.4912,"holy crap! 7:30 miles? That was definitely not on purpose... I think running with other people (who are still 'training') makes me feel like I'd better not drag them down... ran with Nancy again today (sci museum-bu) and while it felt like an effort, I was still able to chat. Also I think the cold inspires me to move a little faster to stay warm or get back faster or whatever-- temperatures dropped to below freezing, and a mild wind",2 sets sp,0,,,,winter04log.html
2004-12-16,2004,12,16,Thursday,51,winter,run,33.82,33:49,,,just killing time before my last final...,lift,0,,,,winter04log.html
2004-12-17,2004,12,17,Friday,51,winter,run,41.1,41:06,5.0,8.22,"held off until the evening so I could run w/detti and J and say goodbye... ran in the dark around the Harvard-footbridge loop. The run felt a little more taxing than I thought it should, but oh well",Myriam showed us a bunch of distance-tailored lifts to do over break-- if I can do these w/o slacking off I should be pretty built by the end of IAP. She told me I could do them 4 days/wk instead of 2 since I'm not racing.,0,,,,winter04log.html
2004-12-18,2004,12,18,Saturday,51,winter,run,50.05,50:03,10.0,5.005,"SO EXCITED TO BE HOME! Despite waking up at 4:30 a.m. EST to catch my flight, and not quite making up the sleep on the plane, this was one of the happiest runs ever. Drove down to TP state beach w/my parents. Dad and I were both going north on the cliffs but I was so amped that I just took off right away and ran alone. Hit the gate at Powerhouse park in a breezy 14:05, and was to the 3 mile mark in around 23:30. Held up on the way back too, 24:54 out and 25:08 back. Man, I can't describe how wonderful San Diego makes me feel. Here's why my run was awesome: 1. Santa Ana winds made it a balmy 68° and I got to run in shorts and a sportsbra 2. People were driving by in convertibles with the tops down. 3. A train that went by was playing jingle bells with it's horn! The doppler effect made that pretty interesting... 4. The sun setting over the beach was flawless as usual.",,0,,,,winter04log.html
2004-12-19,2004,12,19,Sunday,51,winter,run,51.77,51:46,,,"Up Broken Hills, down including Guy Fleming. Didn't work especially hard, 12:30ish up the hill","sp, strength stuff",0,,,,winter04log.html
2004-12-21,2004,12,21,Tuesday,52,winter,run,40.03,40:02,,,"at mammoth. not too bad feeling, no snow on the ground. Probably went a bit slow (esp. on the hills) but my heart working in the altitude","don't have the equipment really to do myriam's lifts, so I picked and chose-- I'll start next week. Did hip abductions, supine hip lift, king dead lift, side hip lift, thin tummy, sp, lunges",0,,,,winter04log.html
2004-12-22,2004,12,22,Wednesday,52,winter,run,43.85,43:51,,,"a little more acclimated then yesterday, but still a slow",strides,0,,,,winter04log.html
2004-12-24,2004,12,24,Friday,52,winter,run,45.43,45:26,,,"last run in Mammoth before the drive down. Made it to the high school but running up here is still a fight. taking off yesterday cut this week down to a five day week but I'm in the offseason so it's no biggie, it just wasn't practical to run. but I had a crazy good day of boarding yesterday-- stuck a couple of new tricks",,0,,,,winter04log.html
2004-12-25,2004,12,25,Saturday,52,winter,run,50.2,50:12,,,"home again. still remnants of the santa ana so it was pretty warm and dry. bike path and up el camino, then up townsgate to check out the new playground by the new elementary school. Coolest playground ever!! Stopped for about 10min there. Pace was good though: 46:23 for the loop (ending at the top of graydon), and under 8 min for the measure mile on the bike path. After the loop I ran over to the school for extras","played around with the hurdles for 20-30 min. gonna call coach and see if there's practice in Jan. Medium's ""B"" day-- I'll post the workouts later",0,,,,winter04log.html
2004-12-26,2004,12,26,Sunday,52,winter,long run,86.85,86:51,10.5,8.2714,"TP state beach, south up Park Rd, past UCSD. Ran into Julie on the way back, she turned around with me and we ran together. Probably picked up both of our paces a bit. Added North Fork-South Fork and Guy Fleming on the way down. Developed a few blisters in the new shoes which wasn't so fun.",,0,,,,winter04log.html
2004-12-27,2004,12,27,Monday,53,winter,run,56.1,56:06,7.0,8.0143,"TP state beach to Guy Fleming and back north to Powerhouse. Surprised myself with the pace, even with the park rd. hill","""A"" day, minus the squats and lat-pulldowns",0,,,,winter04log.html
2004-12-28,2004,12,28,Tuesday,53,winter,run,47.25,47:15,,,just around the neighborhood,"B, minus SB tucks",0,,,,winter04log.html
2004-12-31,2004,12,31,Friday,53,winter,run,42.0,42:00,,,"In Park City visiting Kristina. I was trying to avoid ever taking off two days in a row this winter but flying and staying with other people made it impractical to get out the past couple of days. Woke up at 6 to drop Kristina off at work, came back and napped until it got light out, headed out around 7:45. No problems with the altitude, but it's lower here than Mammoth, maybe just under 7000 ft. It's been snowing since I got here but the roads were plowed.","A, pushups",0,,,,winter04log.html
2005-01-01,2005,1,1,Saturday,53,winter,run,50.45,50:27,6.0,8.4083,"AAHHH loving the crazy pow pow! Haha not that that has anything to do with running, but it's been snowing since I got here and the snowboarding has been insane! We didn't ride today though, Kristina was tired so I ran while she slept in. Used the snow-shoe-tread things that Dad got me for Hanukah, since it dumped a few more feet last night and the plows hadn't gotten out yet. They work really well, I didn't slip at all.",,0,,,,winter04log.html
2005-01-02,2005,1,2,Sunday,53,winter,run,55.48,55:29,6.75,8.2193,"Last run in Park City, went around 4:30 after a full day of boarding. I'm wiped; the little neighborhood hills were eating me alive and I didn't even have the energy to do my strength work. Showered and ate dinner after my run and then crashed for a nap at 7:30 p.m. Probably could have slept until the next day but I had to get Kristina from work.",abs from 'B' day,0,,,,winter04log.html
2005-01-04,2005,1,4,Tuesday,1,winter,run,64.05,64:03,8.0,8.0062,"Around the neighborhood to get some hills in. I'm so sad that Black Mountain Rd. is dead. Not that it's a new thing; it's been inaccessible since just before I graduated, but today I tried to at least find another way in but it's actually physically gone... so sad.","'B,' hurdle work",0,,,,winter04log.html
2005-01-05,2005,1,5,Wednesday,1,winter,run,72.63,72:38,9.0,8.07,"a bit longer than planned, but oh well. Wandered through Carmel Valley again, ran two tempo miles on the bike path towards the end because I got bored, 6:54, 7:03 with just under 3 min of jogging in between.",'A',0,,,,winter04log.html
2005-01-06,2005,1,6,Thursday,1,winter,long run,101.43,1:41:26,12.0,8.4525,"felt pretty sluggish, but I knew I was going to because the last two days were pretty hard. hit my knee on the jersey rail at the end of the Dog Beach bridge (3 mi into the run) and felt it the whole rest of the run. It's still sore and stiff, hmm... Thoughts of the day: - Don't go for a long run with no sunscreen and wearing a sweattie while you're not already tan. - The Brown men's team does not require their California runners to come back early for track, because they train better out here. :D",strides built in at end of the run,0,,,,winter04log.html
2005-01-07,2005,1,7,Friday,1,winter,run,42.47,42:28,5.0,8.494,"continued to rain all day, but not really hard. Went north to 25th st. with Brenna, was pretty windy on the way back but a nice run overall",'B',0,,,,winter04log.html
2005-01-07,2005,1,7,Friday,1,winter,run,33.22,33:13,4.0,8.305,"started a run at San Dieguito Park in the morning on the way back from errands, then remembered I told Brenna I'd run with her. Decided that a double wouldn't kill me an cut the run short. Worked out for the better, because the lagoon was flooded and I don't think I could have handled running more than maybe 40 minutes within the park itself",,0,,,,winter04log.html
2005-01-08,2005,1,8,Saturday,1,winter,run,64.75,64:45,7.5,8.6333,"Deanna called while I was in the car on my way to run to see if I wanted to run with her, so we ended up going together. planning on going around an hour relaxed, up park rd, but deanna wanted to go around 70 and had never been up broken hills so I thought I'd take her. It was pretty muddy and slippery going up but we still managed to do it in around twevle and a half min. Turned around at scripps hospital and hit guy fleming on the way down. either pride or fear of seeming too slow for each other probably made both of us work a little harder, but it was good. Capped off the end of my first real week of mileage in a long time, which felt really awesome.",4 longer strides... skipped my second 'A' day of the week since we worked pretty hard on the run,0,,,,winter04log.html
2005-01-09,2005,1,9,Sunday,1,winter,run,64.65,64:39,7.5,8.62,,'A',0,,,,winter04log.html
2005-01-10,2005,1,10,Monday,2,winter,run,66.52,66:31,8.0,8.315,"pretty sluggish. went down to the bike path for an easier run, because I realized I've had significant hills in every run since I've been home, except last week's long run. Got a shoe sucked off in the mud, but I managed to hop on the other foot long enough to keep my socks clean. On a normal week, I probably would have taken today off, but I'm planning on snowboarding thursday so I'll just keep today and tomorrow easy.",4x100m strides,0,,,,winter04log.html
2005-01-11,2005,1,11,Tuesday,2,winter,run,76.32,76:19,9.0,8.48,"somehow I am sleeping 9 hours a night and am still tired. oh well, got plenty of time to rest up","strides, 'B'",0,,,,winter04log.html
2005-01-12,2005,1,12,Wednesday,2,winter,long run,108.47,1:48:28,13.0,8.3438,"Stopped raining last night and was bright and beautiful when I headed out. Good thing too, I thought I might grow mold or something. parked at Fletcher Cove and ran north to ""Grandview St"" or something like that, past Leucadia Blvd. Good run, out in 55 or so and back a few minutes faster, thanks to some pickups I threw in",,0,,,,winter04log.html
2005-01-13,2005,1,13,Thursday,2,winter,,,,,,Gone boarding...,,0,,,,winter04log.html
2005-01-14,2005,1,14,Friday,2,winter,run,70.7,70:42,8.5,8.3176,"Got dropped off at the bike path. To El Camino and back the other way to Carmel Valley Rd, then home",'A',0,,,,winter04log.html
2005-01-15,2005,1,15,Saturday,2,winter,run,84.28,1:24:17,10.0,8.428,"Broken Hills was closed, turned around and ran up Park Rd. to UCSD",,0,,,,winter04log.html
2005-01-17,2005,1,17,Monday,3,winter,long run,112.57,1:52:34,13.0,8.6592,"back in Boston. Tights, woohoo.... it's like... cold here. oh well. a bit of snow in spots. Went around Jamaica Pond, to the Arboretum. Ran around there for a bit and ended up coming out a wrong entrance, so the run ended up being longer than I meant it, but it was pretty",'B',0,,,,winter04log.html
2005-01-18,2005,1,18,Tuesday,3,winter,run,67.05,67:03,8.1,8.2778,science museum-footbridge. getting colder,'A',0,,,,winter04log.html
2005-01-19,2005,1,19,Wednesday,3,winter,run,50.03,50:02,7.0,7.1471,dropped by practice today. science museum-BU with the team.,continuous warmup,0,,,,winter04log.html
2005-01-20,2005,1,20,Thursday,3,winter,run,66.72,66:43,8.0,8.34,,'B',0,,,,winter04log.html
2005-01-21,2005,1,21,Friday,3,winter,pool,,(45),,,The outside of my foot is hurting; something I started feeling around Wednesday. Aquajogged then swam 10 lengths. Left my cap and goggles at home though. Kind of intended to go closer to an hour but I was bored out of my mind.,,0,,,,winter04log.html
2005-01-22,2005,1,22,Saturday,3,winter,long run,105.72,1:45:43,12.5,8.4576,"Fresh pond twice around. I ended up a bit underdressed somehow; it wasn't that cold out but my arms and hands were seriously cold, especially my defective left hand. Foot started hurting a bit about halfway through. *Switched tomorrow's long run to today because it's supposed to snow pretty crazy tonight.",,0,,,,winter04log.html
2005-01-24,2005,1,24,Monday,4,winter,pool,,(60+),,,"My foot hurt after the run Saturday and still hurt on Sunday, so I decided to take the day off (and let the blizzard win its war, dang). It felt a little better this morning after the rest, but I figure I have plenty of time to make up the training so I'm going to keep off it for the next couple of days. Feels like a tendon type strain, maybe I slipped on the snow or ice or something. Warmed up and cooled down with swimming laps Julia showed up part way through, so at least I had company.",'A',0,,,,winter04log.html
2005-01-25,2005,1,25,Tuesday,4,winter,pool,,(65),,,"Woke up early to workout before class. It was nice to have everything done by 9, but man, that was early. Warmed up with swimming, jogged a bit, HBH's drills, some 'sprints', swam to cool down. Time went quickly today, yay. And the foot is feeling better with the rest. I'll go a couple more days to be sure.",,0,,,,winter04log.html
2005-01-26,2005,1,26,Wednesday,4,winter,elliptical,60.0,60,,,"the Z-center closed at noon today, along with the rest of MIT... for a snow day! Craziness! In any case, it meant that the pool was not an option, so I ellipticalled downstairs in the dorm's cardio room. Brought down the iPod and listened to Rancid while I did ""weight loss 2"" and ""cross training 2"" in succession. Somehow, it managed to be not boring. Meanwhile, since I wasn't going anywhere, I tried to figure out how close ellipticalling was to running. According to the machine, I ran around 15-16k strides in that hour. Now, running, they say you get close to 200 strides/min, which is just under 16000 strides in an hour. So that's close. But the HR doesn't get nearly as high; I was around 130 for most of it. I can get it closer to running if I crank up the resitance, but then I can't do it for very long. So I dunno. No conclusions really, just thinking. Can wait to start running again. I'll be patient though.",'B',0,,,,winter04log.html
2005-01-27,2005,1,27,Thursday,4,winter,,,,,,"took the day off. with class 9-4 and a bunch of stuff to do in the evening, I just didn't have the energy to squeeze a workout in",,0,,,,winter04log.html
2005-01-28,2005,1,28,Friday,4,winter,elliptical/aqua jog,50.0,50,,,"worked out before class again. something about getting out when it's still dark really makes you feel like a badass. anyway, ellipticalled for 20 min then went down to the pool and aquajogged, with a few hard intervals mixed in. didn't have time to do strength though, with 2.670 going all day. but my engine is so pretty!",,0,,,,winter04log.html
2005-01-29,2005,1,29,Saturday,4,winter,pool,55.0,55,,,"alternated swimming/aquajogging. gonna run tomorrow regardless, i'm bored as heck",'A',0,,,,winter04log.html
2005-01-30,2005,1,30,Sunday,4,winter,run,61.2,61:12,7.0,8.7429,"that felt great. stretches of unplowed snow slowed me down, but who cares. my plan to go sci musuem-river were thwarted when the path past the harvard bridge was entirely unrunnable, but i ran into boston toward the fens and it was all good. felt the foot a little, but no pain, so i'm going to keep running",,0,,,,winter04log.html
2005-01-31,2005,1,31,Monday,5,winter,long run,101.5,1:41:30,12.0,8.4583,"headed towards the reservior thinking that would be a mostly plowed route. everything was clear except the reservior itself. tried to run around it for a bit, but it got too snowy just over halfway around, so I hopped into the street and ran around Boston College. Went up Summit Ave on the way back; I feel so much stronger than before break","'B' minus box jumps, step squats",0,,,,winter04log.html
2005-02-01,2005,2,1,Tuesday,5,winter,run,72.75,72:45,8.5,8.5588,"I guess last week was a good week (if there ever are any) to be cross training--third day in a row that it was above freezing when I ran, yay. out toward bunker hill, then followed the freedom trail to boston common. ran around the commons for a bit, then back on the esplanade. thinking of racing the home meet in two weeks","hip abductions, U supine hip lift, side hip lift, thin tummy (from 'A')",0,,,,winter04log.html
2005-02-02,2005,2,2,Wednesday,5,winter,intervals,,(40) wu/cd,7.5,,"Wanted to see how fit I was, to see if I would embarass myself by racing next weekend, so I made up my own workout: 3x1200, 400, 300 on the indoor track, with just under 3 min recovery. Was shooting for 94's on the 1200's, but if I fell off pace I would just stop. Made it through all three: 4:43, 43, 41. 86, 63 for the 4 and 3. Pretty pleased with how it went. Wasn't working out under ideal conditions; it was a little close to lunch and my legs were a bit tired on the warmup.","lat pulldowns, incline dumbell for yesterday (wu/cd split 20'/20')",0,,,,winter04log.html
2005-02-03,2005,2,3,Thursday,5,winter,run,83.08,1:23:05,10.0,8.308,arboretum,some sp,0,,,,winter04log.html
2005-02-04,2005,2,4,Friday,5,winter,run,55.4,55:24,6.0,9.2333,"woke up early to run before class and leaving for NYC. Super sluggish, maybe because I wasn't awake or fed. Shooting for 7.5 or so, but after I got to Elliot bridge I realized I was going nowhere",,0,,,,winter04log.html
2005-02-07,2005,2,7,Monday,6,winter,run,39.58,39:35,5.0,7.916,"got sick over the weekend visiting the cousins. No fever, and I had already promised to go to practice, so after an afternoon nap and some Tylenol cold I decided that I could manage a short run. Wasn't too bad, still would like to race saturday.",1 set sp,0,,,,winter04log.html
2005-02-08,2005,2,8,Tuesday,6,winter,run,25.82,25:49,3.5,7.3771,taking it easy still. too bad continuous warmup killed me,cwu,0,,,,winter04log.html
2005-02-09,2005,2,9,Wednesday,6,winter,run,36.38,36:23,4.0,9.095,"legs still feeling shot from yesterday. almost didn't want to run, but after doing 8 slow warmup minutes inside, i felt good enough to go out for a longfellow loop. giving up on the mileage this week though",1 set sp,0,,,,winter04log.html
2005-02-10,2005,2,10,Thursday,6,winter,run,27.75,27:45,4.5,6.1667,"some warmup inside, continuous warmup, and a longfellow loop again.","cwu, some sp",0,,,,winter04log.html
2005-02-11,2005,2,11,Friday,6,winter,run,37.43,37:26,4.5,8.3178,took the prefrosh down Comm. Ave to Boston Common and back on the esplanade,,0,,,,winter04log.html
